question,option1,option2,option3,option4,option5,correct
"Dalam psikologi kognitif, istilah ""Attentional Spotlight"" mengacu pada kemampuan otak untuk… ",Memproses seluruh informasi visual secara bersamaan tanpa prioritas ,Mengarahkan sumber daya perhatian ke area tertentu seperti sorotan lampu panggung ,Menyimpan memori jangka panjang secara otomatis tanpa usaha sadar ,Mengalihkan perhatian ke stimulus paling keras di lingkungan ,Tidak Tau,Mengarahkan sumber daya perhatian ke area tertentu seperti sorotan lampu panggung 
"Fenomena ""Presence"" dalam komputasi pervasif paling tepat dianalogikan dengan konsep psikologi… ",Disonansi kognitif — ketidaksesuaian antara keyakinan dan perilaku ,Flow state — kondisi seseorang terserap penuh dalam suatu aktivitas ,Dunning-Kruger effect — overestimasi kemampuan diri sendiri ,Confirmation bias — mencari informasi yang mengkonfirmasi keyakinan lama ,,Flow state — kondisi seseorang terserap penuh dalam suatu aktivitas 
"Dalam teori beban kognitif (Cognitive Load Theory), ""Germane Load"" merujuk pada…",Beban yang muncul akibat desain instruksional yang buruk dan tidak perlu,Beban mental yang berkaitan langsung dengan kompleksitas materi itu sendiri,Usaha kognitif yang digunakan untuk membentuk skema dan pemahaman mendalam,Kapasitas memori sensorik yang menampung stimulus sebelum diproses lebih lanjut,Tidak Tau,Usaha kognitif yang digunakan untuk membentuk skema dan pemahaman mendalam
"Konsep ""Context-Awareness"" pada sistem komputasi pervasif paling erat kaitannya dengan kemampuan psikologis manusia dalam…",Mengingat kembali informasi lama tanpa petunjuk apapun,Menyesuaikan perilaku berdasarkan situasi dan lingkungan sekitar secara adaptif,Mengabaikan seluruh rangsangan yang tidak relevan secara permanen,Menghitung probabilitas kejadian acak secara sadar,Tidak Tau,Menyesuaikan perilaku berdasarkan situasi dan lingkungan sekitar secara adaptif
"Dalam interaksi manusia-komputer, ""Mental Model"" pengguna terbentuk melalui…",Struktur kode program yang ditulis oleh pengembang perangkat lunak,Pemahaman intuitif pengguna tentang cara kerja sistem berdasarkan pengalaman dan ekspektasi,Kecepatan prosesor yang menjalankan aplikasi tersebut,Jumlah memori RAM yang tersedia pada perangkat,Tidak Tau,Pemahaman intuitif pengguna tentang cara kerja sistem berdasarkan pengalaman dan ekspektasi